{
  "slice_id": "slice-008",
  "verdict": "approved",
  "timestamp": "2026-04-14T11:30:50.1649404-04:00",
  "coverage_summary": {
    "acs_total": 12,
    "acs_covered": 12,
    "test_count": 22,
    "acs_with_edge_cases": 6
  },
  "ac_coverage": [
    {
      "ac": "AC-001",
      "tests_found": [
        "test-audit-input/test-files/tests/slice-008/TenantSettingsPageTest.php"
      ],
      "happy_path": true,
      "error_path": false,
      "status": "adequate"
    },
    {
      "ac": "AC-002",
      "tests_found": [
        "test-audit-input/test-files/tests/slice-008/TenantSettingsPageTest.php"
      ],
      "happy_path": true,
      "error_path": false,
      "status": "adequate"
    },
    {
      "ac": "AC-003",
      "tests_found": [
        "test-audit-input/test-files/tests/slice-008/TenantSettingsPageTest.php"
      ],
      "happy_path": true,
      "error_path": false,
      "status": "adequate"
    },
    {
      "ac": "AC-004",
      "tests_found": [
        "test-audit-input/test-files/tests/slice-008/TenantSettingsPageTest.php"
      ],
      "happy_path": true,
      "error_path": false,
      "status": "adequate"
    },
    {
      "ac": "AC-005",
      "tests_found": [
        "test-audit-input/test-files/tests/slice-008/TenantSettingsIsolationTest.php"
      ],
      "happy_path": true,
      "error_path": false,
      "edge_cases": [
        "tenant B persistido antes do acesso e salvamento do tenant A",
        "dados do tenant B nao aparecem na leitura nem na gravacao do tenant A"
      ],
      "status": "adequate"
    },
    {
      "ac": "AC-006",
      "tests_found": [
        "test-audit-input/test-files/tests/slice-008/TenantSettingsAuditTest.php"
      ],
      "happy_path": true,
      "error_path": false,
      "status": "adequate"
    },
    {
      "ac": "AC-007",
      "tests_found": [
        "test-audit-input/test-files/tests/slice-008/TenantSettingsValidationTest.php"
      ],
      "happy_path": false,
      "error_path": true,
      "edge_cases": [
        "CNPJ ausente",
        "CNPJ invalido",
        "CNPJ duplicado em outro tenant"
      ],
      "status": "adequate"
    },
    {
      "ac": "AC-008",
      "tests_found": [
        "test-audit-input/test-files/tests/slice-008/TenantSettingsValidationTest.php"
      ],
      "happy_path": false,
      "error_path": true,
      "edge_cases": [
        "razao social vazia",
        "e-mail principal invalido",
        "perfil operacional invalido",
        "perfil intermediario ou acreditado sem emissao metrologica"
      ],
      "status": "adequate"
    },
    {
      "ac": "AC-009",
      "tests_found": [
        "test-audit-input/test-files/tests/slice-008/TenantSettingsPageTest.php"
      ],
      "happy_path": false,
      "error_path": true,
      "edge_cases": [
        "usuario sem papel gerente bloqueado no acesso ao formulario"
      ],
      "status": "adequate"
    },
    {
      "ac": "AC-010",
      "tests_found": [
        "test-audit-input/test-files/tests/slice-008/TenantSettingsPageTest.php"
      ],
      "happy_path": false,
      "error_path": true,
      "edge_cases": [
        "tenant suspended em modo read-only pode visualizar",
        "salvamento em modo read-only retorna bloqueio"
      ],
      "status": "adequate"
    },
    {
      "ac": "AC-011",
      "tests_found": [
        "test-audit-input/test-files/tests/slice-008/TenantSettingsPageTest.php"
      ],
      "happy_path": false,
      "error_path": true,
      "edge_cases": [
        "vinculo de tenant trocado antes do POST",
        "papel do vinculo alterado apos a resolucao da transacao"
      ],
      "status": "adequate"
    },
    {
      "ac": "AC-012",
      "tests_found": [
        "test-audit-input/test-files/tests/slice-008/TenantSettingsValidationTest.php"
      ],
      "happy_path": false,
      "error_path": true,
      "edge_cases": [
        "falha ao persistir filial raiz desfaz a operacao inteira",
        "tenant, company e branch permanecem consistentes apos rollback"
      ],
      "status": "adequate"
    }
  ],
  "findings": [],
  "anti_patterns": [],
  "next_action": "approved"
}
